subreddit,body,controversiality,score
nba,"The Celtics are incapable of playing defense without fouling.  They foul with their lower bodies instead of up high, and man it's frustrating to watch when the refs allow a ton of unnecessary contact every single possession. Wisconsin fans can't be too salty after 14 years with Bo Ryan, but now I fully understand why most teams hated playing against the Badgers.",0,8
freefolk,"It would have solved The Dragon Queen problem though. 
Now poor Missandei has to hear all their bitching all over again.",0,5
gameofthrones,What was it Grey Worm did at the trench? I couldn't quite tell. He threw a lever or something and some spikes appeared but I couldn't tell what that was all about.,0,1
nba,Rockets supporting cast is keeping me from feeling bad for them with all these 3s. Valiant effort to stay in this one.,0,2
worldnews,Things are never boring when you’ve got a government pissing all over laws and the Constitution every day.  It’s many things but boring isn’t one of them.,0,4
nba,Lol why don't you read some,0,0
worldnews,"Fuck you, and your canoe... goddamit my butthole clenched so hard I could have made a diamond.

Fuck...",0,14
freefolk,"I'm not blaming Jon, I'm just saying those were the sequence of events, lol. 🤷‍♂️",1,4
relationship_advice,Yikes I was just asking what you had in mind. I didn't get that from your post. 🤷,0,5
nba,They played last year lol,0,2
politics,"https://twitter.com/TPM/status/1123592792540946432?s=19

&gt;House Judiciary Committee Says Agreement Reached To Have Mueller Testify",0,66
politics,"To follow up:

They also began investigating Trump’s actions/reactions toward the investigation and found evidence that trump may have attempted to obstruct the investigation but weren’t able to prove it beyond reasonable doubt because the people that Trump ordered to break the law refused to do so.",0,3
relationship_advice,They’re both garbage. You dodged a bullet,0,1
freefolk,And what she had done by staying?? She had no weapon until arya gave her one? So it's not like she was planning to fight so her staying there was never an option unlike lyanna who was prepared for the fight and died doing so.,0,-1
nba,you're on crack if you think Kyrie is better than Harden,0,9
politics,"Why is he in trouble?

Will he be prosecuted? No, he is in charge of the Justice Department.

Will he be fired? No, Trump is President and Barr is doing his bidding.

Will he be impeached? No, the Senate will refuse to remove him even if Democrats had the guts to impeach him in the House (and I doubt they do). 

Nothing, no consequences, no trouble. He's doing exactly what he was hired to do.",0,1
gameofthrones,"Exactly, but it needed to go in his heart, so she needed him to turn around.",0,1
politics,"We just disagree I guess and will have to leave it at that. I see both sides doing it (the right picking a few tangible things and sticking with it for decades, and the left coming up with insane random conspiracies), but you just see the right doing it.",0,1
gameofthrones,"&gt;Thank you!!

lol - same here man :(",0,1
politics,"&gt; The fact is the majority of people incarcerated as felons are non-violent offenders. 


You don't get it, that doesn't matter to most voters. They hear prison, they think rapist and murderers.",0,1
freefolk,"I tell myself that given the circumstances, Mel put two and two together and figured out that the blue eyes must mean Arya killing WW/NK. TBH, thats just me trying to make sense of all the loose threads.",0,0
gameofthrones,"Nope, thousands of people are complaining about this, it's not an issue with our TVs or streams.",0,1
gameofthrones,"It's also basic story telling. The worst kind of despair is one that is snatched from the jaws of victory. This is used in Lord of the Rings all the time.

1) Helms Deep: They kick the Iruk-Hai's asses for the first part. Theoden seems pretty confident that they have this battle in the bag. Then the walls are breached which immediately causes everyone to panic.

2) Minas Tirith: The Rohirrim arrive and are again kicking ass. Then the Witch King sends in the Haradrim Elephant riders which were placed in reserve specifically to counter the Rohirrim. The music even stops when they arrive so as an audience member you immediately know this is bad news.",0,5
relationship_advice,"Honestly, I know it’s hard to hear this, and harder to believe it after dating him for 4 years, but this guy is a total POS and you are far better in the long run not knowing him. He’s not just a bad person, he sounds like a sociopath.

Ghosting is one of the cruelest things a person can do to another. I’m not talking about blocking someone after a bad date or having things fizzle out on a dating app. I mean ending a substantial relationship this way. About the only way it can be justified is if the person is harassing you or you have a legitimate fear of violence from them.

People talk about it like it’s just rude or bad etiquette. It’s far beyond that. It’s gaslighting, it’s mental terrorism, it’s a complete denial of that person’s autonomy and their right to know whether they are in a relationship or not. It’s extremely common for people who are ghosted by long term partners to have mental breakdowns or fall into serious depression. It’s one of the worst possible way to end a relationship, far worse than open infidelity or emotional dishonesty, up there with physical violence and severe verbal abuse IMO.

Take care of yourself OP. Don’t neglect your other relationships. Let everyone know what a shitty person your ex is",0,10
worldnews,"Maybe push for more fair elections, rather than trying to overthrow the government by military force?",0,1
gameofthrones,"Lol. That's why I've been waiting to restart the book series too. I finally gave in and started GoT again the other day, only a few chapters in tho.",0,2
worldnews,What are you referring to in the quoted text as the red flag to look for? How does this support your definitive claim that 85000 illegal voters were found in Texas when they weren't proven?,0,2
worldnews,More like Scandinavia and much of Europe.,0,6
relationship_advice,Why don’t you date somebody your age and maturity. Hello.,0,3
freefolk,"He could be caught in the middle between Sansa and Dany with Arya siding with Sansa and Dany losing trust in him because Sansa pushes his claim to the throne (and Arya's killing of the NK) I mean, I could see Dany losing it when she feels the thing she's worked so hard and scarified so much for is going to be take away. And if Tyrion sides with Sansa as well.  Even if jon doesn't even want the throne it might eat away at her. But I really don't buy Dany is the actual bad guy and not Cersei. 

I also do think they'll get Jon a very ""unexpected"" kill to make up for the NK kill steal.",0,4
politics,"*but her emails* 

Just give it a fucking break Graham",0,32
relationship_advice,"Tbh it sounds like he’s exaggerating to try to impress you? Or to hurt you? 

Either way he sounds awful. Definitely a biiig red flag.",0,5
freefolk,Ain't that the truth,0,6
worldnews,Front page of /r/all the only way to escape politics is to get off of reddit,1,5
gameofthrones,"In an earlier era, *The Wire* and *Six Feet Under* could have not just endings but show something of what happened afterwards, but now I am starting to think orders are to have ambiguous endings such as *The Sopranos*.

I have totally changed my mind and expect an ending that is not an ending.",0,1
politics,"32 days and whadaya get, 

Another potato and deeper in debt,

Saint Peter dontcha  calI me cuz I can’t go,

I owe my soul to the Internet Research Agency.",0,3
relationship_advice,"Sexless relationships won’t work. Eventually, He will find his pleasure elsewhere. Maybe think about having an open relationship?",0,1
relationship_advice,I think there is more to this. I think going by your story you have tried to lose weight in the pass but failed ?,0,89
relationship_advice,"Ah. My ex left me close to finals of one semester, and then I found out she left me for another at the start of the next semester. Screwed me up academically pretty bad. I 1027% respect you for waiting.",0,1
gameofthrones,"The last episode will just be 60 minutes of danaerys on the throne, with john snow and the knights of octagonal table heartily laughing as they drink mead and tell jokes.",0,2
gameofthrones,"&gt;Dude I get it, you're getting slaughtered with downvotes but it's hilarious that this gained so much genuine traction lol

Yups didn't expect that. Both foreshadowers and anti foreshadowers are out there for me now.",0,2
relationship_advice,"It’s definitely something I’m gonna try, cause I feel like his reaction to an innocent question like that will probably tell me a lot about what I need to know 

That’s what I always thought, whenever I read stories kinda similar to mine it’s always the other way around. Again, he could be different as an individual but it doesn’t explain a sudden switch of libido. I even asked if he still masturbates, considering we never have sex, and he said he honestly doesn’t and doesn’t have any desire to, he said if he had any desires he would rather have sex which makes sense. At first I kinda didn’t believe it, but tbh idk when he would have time to, he’s out all day and comes back at night, we eat together and sleep. I hate to sound judgemental but I feel like there’s something wrong with that? Sometimes I wonder if he’s asexual but that also wouldn’t explain a sudden switch I don’t think. He definitely wasn’t pretending before so idk what changed 

You certainly do! I appreciate some comedy in this situation haha",0,1
freefolk,It's but a mere typo on the internet.,0,1
nba,Houston getting worked down low,0,2
gameofthrones,Watch your mouth when you talk about our rightful queen.,0,1
gameofthrones,How is it the same with the Night King? No one defeated any White Walkers or the wight dragon. The Night King didn't fight Jon or anyone for that matter besides slaughtering Theon. Arya pretty much took down the entire AotD by killing the NK and saved the day mostly by herself. Everyone else might've killed some wights but that effort is quickly undone when the NK resurrected them back again. So literally everyone ended up being useless (especially Bran) except Arya,0,18
freefolk,"Yup, he got too cocky and died for it.",0,8
nba,OMG that reporter is gorgeous,0,5
gameofthrones,This is the writers logic in it's full glory,0,2
nba,Up there with Vs. Wizards Curry who averages 28 ppg on 51/49/92,0,1
nba,Lol  I'm glad I don't waste my time watching anymore that's crazy,0,1
relationship_advice,Is there a reason why you can't go over and check up on her? Or even call?,0,1
nba,Why they wiping the floor lol no one even sweating,0,2
relationship_advice,"&gt; Show some respect for yourself and move on.

She did. She's saying she doesn't want him to approach her, as her friend warned he might. But that was at the bottom of the post, I assume some readers didn't quite make it there.

&gt;He still chose her.

While high off his titties. lmfao As soon as she started blabbing about their arrangement to their friends in a desperate attempt to make it official he ran away in utter fucking humiliation. So your ""guess"" about why he ""chose her"" is really weird because he like. Didn't. He literally fucked her for/while on drugs and then ran away. Doesn't make him innocent but don't go making up some weird story about him falling madly in love with his coke dealer because his ex was somehow worse.

&gt;too embarrassed to be honest with you. Bullshit. He knew what the hell he was doing. He was doing drugs and fucking other women.

Oh, I don't doubt that he was humiliated but I do agree with you here, he's no better than the chick.

&gt;Get some counseling for your co-dependency

Again, she already moved on, if you get to the bottom of the post she very clearly said she doesn't want him back and doesn't want to see him so her concern is not wanting him to even show up. I get that, they were together for 4 years and yeah, it can feel humiliating and kind of disgusting at first to find out you've been cheated on. It really hasn't been that long since she found out, she doesn't have to want him back to still feel grossed out and betrayed. If you can flip a switch and suddenly feel nothing negative that fast, you've probably got a personality disorder you may want help for.",0,11
worldnews,I'm not in college. I'm simply stating that one should know the facts before having such a strong stance on the issue. It's insane to me that this common sense is lost these days. Everyone jumps to their partisan talking points.,0,15
gameofthrones,"Did we ever see the night king fight a defensive battle? The second bran finds TNK the potential for the other two dragons to ambush TNK goes up. Going on the offensive to remove that threat, especially when victory looks certain isn't too far fetched",0,8
nba," [https://streamable.com/jin2m](https://streamable.com/jin2m) 

&amp;#x200B;

STEPH WOULD NEVER DO WHAT HARDEN DOES",0,2
worldnews,"No according to John Oliver that was Jared.

A career investigator; I imagine him sounding like Liam Neeson in Taken.

""I will make you talk""",0,1
gameofthrones,I replied to the above comment for your edit.,0,1
worldnews,"Oh really? These don’t look like wealthy white descendants of Europeans https://youtu.be/_SgIG47BLaY

Now, please don’t make this a racial issue. This is not USA, nor South Africa... I went to a public university (Universidad Simón Bolívar) where people from all social backgrounds study, and the great majority of students absolutely despise this dictatorship.",0,8
gameofthrones,"**Spoiler Warning:** All officially-released show and book content allowed, including trailers and pre-released chapters. No leaked information or paparazzi photos of the set. For more info please check the [spoiler guide](/r/gameofthrones/w/spoiler_guide).

*I am a bot, and this action was performed automatically. Please [contact the moderators of this subreddit](/message/compose/?to=/r/gameofthrones) if you have any questions or concerns.*",0,1
politics,And they say that while they go about the business of turning us into Somalia,0,1
worldnews,You ever seen the news on TV? For half an hour of news half would be advertising.,0,3
freefolk,#**S E E T H I N G**,0,0
politics,I'm pretty sure Mueller doesn't want people to commit crimes.,0,1
freefolk,....of course Your Grace.,0,10
relationship_advice,"That's right, my SIL egg, my sperm, makes a beautiful set of twins!",0,24
politics,"&gt; And there is as much evidence that Bill Clinton is a pedophile as there is that Roy Moore is one.

Post it then. Oh that's right you can't, as it doesn't exist.

Trump went to court accused of raping a small girl. Clinton never did.",0,4
freefolk,"Sam cried, Edd died",0,21
freefolk,"Would it have really mattered if Bran died anyway? Sure, he’s a living encyclopaedia, but everyone seemed to do just fine the past couple thousands years while the old 3ER was in a tree beyond the wall. Arya still could have killed the NK afterwards.",0,3
freefolk,"It's also unnerving b/c undead media has hammered bite-transmission into my head. They're all going to need some ye olde bactine, so I hope they didn't drink all the wine.",0,1
gameofthrones,"Yea, at this point I think the show has abandoned the lore in the books. I think HBO took the whole prophecy bits and spread them out to a few characters to cause reddit to explode.",0,1
relationship_advice,So how did you find out he was bigger than you? Did you just ask her or she just out of the blue or during one of these talks felt the need to tell you this? Either situation is dumb IMO but if she told you that on her own will I’d start asking yourself if you really wanna still be in this,0,1
politics,"I will believe he is in deep trouble when he faces any consequences for his actions. Until then, not so much.",0,3
relationship_advice,"A lot of people are saying that she doesn't love you, but I think she does. Love isn't about choice, it's about a feeling. And love is reciprocal. Knowing how much you loved her made her love you. She's telling you this so you can be closer, and so she can eventually let you feel the same way she felt as you took care of her -- cared for and loved. 

I hope you see this as a bid for transparency and intimacy. But ultimately it's up to you what to do.",0,-1
politics,That's a really good point because I think he held more press conferences in the last month than Sarah Sanders did.,0,90
politics,"I'm sure the fucker will keep saying ""I do not recall"" to every single question.",0,4
politics,"Once upon a time Republicans actually could be accused of loving this country. 

Reagan would be appalled.",0,1
freefolk,"My issue isn't about Dany alone. It's about people who  act like the North owed Dany something, when they didn't. Everybody was obligated to fight together to survive, but they are not obligated to like each other, or agree with each others political takes or be grateful for doing what they should be doing regardless.

I'd like to believe that, but Dany pulled her hand away from Sansa and frowned when she asked about Northern Independence. Dany has shown zero tolerance toward the idea of Northern Independence, and until I see otherwise, it will continue to be a problem unless one side gives.

You say she showed Jon all of that? Yeah she did and that's why he bent the knee (that and because he loved her). But aside from fighting in this war, (which she was given the North beforehand in exchange, so she got something out of it), what has she done to show the North who she is? Davos said Dany has to earn their respect.

I saw that preview. I also saw that not a single Stark (Arya, Sansa, Bran, Jon) is there celebrating with her. Which is something to note.",0,1
relationship_advice,"That's unfortunate. You're behaving reasonably and she is sort of shutting down communication.

Some direct questions might work. Tell her directly that in a relationship you do want intimacy more often, and then ask if her if there is something specific you can do or if she wants to work on it. Perhaps direct questions will get her to open up instead of putting you off. Don't interrogate her, but ""I really want to work on this, what do you think we can do to get the spark back in our sex life?"" ""Is there anything specific you want me to do or try?"" ""Is there some outside stessor that's making it hard right now?"" Etc.",0,5
nba,Dude has been a hater all year. Most think he is Ryan Hollins.,0,3
relationship_advice,That’s a good idea! Thank you,0,1
politics,Strange? You're gonna have to elaborate on that,0,2
relationship_advice,Why are you still with this loser?,0,1
gameofthrones,"You have to sacrifice yourself to become faceless, be servant of god of death .. or just become blind for few episodes, then do whatever you want with your new superpower and serve your own interest.",0,1
nba,They are converting them at a phenomenal rate though. I dont think they can sustain it though but Boston needs to move the ball more we arent converting many shots and we need to get to the rim more.,0,1
freefolk,hold on...i have to google what gtfo means,0,1
politics,I swear I’m watching the real Veep.,0,1
relationship_advice,"Where is the marriage supposed to occur? If it's in the UK, then you'll have to try CPS (or equivalent). If he was to leave the country, the answer is simply don't get on the plane (and still probably contact CPS so that he will be registered in the system and not end up homeless). That is assuming that the parents want him to get married before he is 18, because before then you NEED parental signatures unless someone is emancipated). I am also assuming that your friend is looking for a way out. 

&amp;#x200B;

Child marriages are actually not unheard of in the West, as children can be legally FORCED to marry through the ""permission"" process, as the parent is the one giving consent. All the child has to do is say ""I do."" Which is an absolutely horrendous thing. In some places in the West, marriages can occur even before puberty through this system.",0,0
nba,"Was hoping to keep it closer if we took the L. Shots just weren't falling and. Kyrie and Tatum had awful games. That being said, splitting these first 2 is what we wanted. Now the C's go back to Boston for game 3 with homecourt advantage",0,4
nba,Is this ride safe,0,7
worldnews,"I'd propose that severe climate change that has been impacting all equatorial nations leading significant loss of grains for feed. The nation relied heavily on oil as it's economic engine, which the price collapse in the 90's clearly impacted them. Most accounts show a decent recovery with Maduro's transition of industry to be self-reliant up to 2002. Unfortunately, coups, western interventions and Maduro's wild reaction by dropping productive business with the West, threatening the petrodollar and isolating the country to focusing business with Iran, NK and Russia. It became effectively the Libya of the Americas. There's speculation that our focus on producing tarsands and fracking, at a loss, was to undermine the demand for the similar quality crude from VZ (which is cheaper to extract and refine). We're both oversimplifying the issues there, and in most of Central/South America",0,1
relationship_advice,True and your right I should change my mentality I'm going to ask first thing in the morning thank you.,0,3
relationship_advice,WTF is wrong with your gf that she's friends with this idiot?,0,6
relationship_advice,You're dating a teenager. He's acting like one. 25 and 19 is going to have a pretty big difference in maturity levels.,0,3
nba,Lebron&gt;Magic&gt;Bird on like 90% of lists.,0,8
gameofthrones,He had his ice sword on him and could have stabbed him had he been close enough to get eaten.,0,2
relationship_advice,It’s just a learning phase you need to get trough,0,3
gameofthrones,It united everyone against Cersei. It brought Dany and Jon together. Both of those are pretty important and not at all pointless,0,2
politics,You just described me :(,0,15
worldnews,You have not answered. What other group?,0,1
relationship_advice,Yeah op definitely browbeat your husband into apologizing for talking to a coworker and telling her that you got jealous for some reason.,0,1
freefolk,God no the show couldn't get more fanfiction-y,0,3
gameofthrones,"The scene had nothing to do with quiet, it was about “seeing”, and I doubt no one could see her running past the army. I get it, she ran past them when that WW’s hair moved, but they didn’t react at all, it was like “oh, just my imagination”. It wasn’t about hearing, it was about seeing, so being silent doesn’t have shit to do with that scene, this isn’t Skyrim where you sneak in plain sight of everyone. Guys running the show just wanted a “badass” moment and they said fuck logic, we’ll do it anyway, cause that’s what matters to them, little girls being badass, not logic and common sense",0,2
politics,Sweet!!! Another distraction from the fact that Washington has sold out the American people to the highest bidder.,0,-1
relationship_advice,"The mutual male friend, is not your friend.  He didn't need to say anything.  I question motive... Probably looking to move out of your friend zone into more fertile pastures.

This is not a smoking gun, just some blue banter between friends. Inappropriate, yes.  But context is important- it was said in private between friends, never meant for your ears, and he said nothing negative about you whatsoever.

Buddy boy with the big mouth is actively trying to fuck up your relationship.  Classic snake move. Sew discontent, be there to pick up the pieces.",0,3
relationship_advice,"We are at around \~7.7 billion people. It's unlikely that there isn't anyone else for you. It may be hard to imagine but it's true. There are people out there who would give it their all just to be with someone as devoted to a relationship as you. (There are also people on the other end of the spectrum but that's another story.) This is just a pit stop, you have got a long way to go. The good thing is, you get to choose the road you want to travel on... for the most part at least.",0,1
worldnews,He made it legal to conceal carry in national parks. He also reversed a 9/11 ban to make it legal for Amtrak passengers to carry guns in checked baggage.,0,25
freefolk,"Cut the prelude then or leave the fight in, idiots",0,15
worldnews,"Spoken like a truely ignorant middle class person....

Working class people have been able to fly and afford vacation for over 50 years now... It's called saving.... Where did you get this completely incorrect idea that ""only rich"" used to be able to fly? Before the 40's, maybe yeah. But flight was barely a thing back then...",0,-4
politics,"Well then, I guess this means that Mueller will be showing up to the House Committee hearing without any pressure to do so. 

That also will make Thursday's hearing (if Barr shows up) all the more explosive.",0,28
worldnews,Ya exactly. I’m just trying to figure out which(if not both) situations are applicable. I don’t see doctors mentioned at all in these comments,0,1
freefolk,Hes been burned on the show before (via a lantern) whereas danny seems to have close to 100% immunity. Maybe since hes only half targ the cool fire powers decided to pass on him lol,0,28
freefolk,I don't know I think Arya might have needed magic to pull off what she did.,0,1
gameofthrones,Gimli with a dragonglass axe would kill way more wights than Tyrion could.,0,1
