subreddit,body,controversiality,score
nba,"**Replays/alternate angles**
                        


*I am a bot, and this action was performed automatically. Please [contact the moderators of this subreddit](/message/compose/?to=/r/nba) if you have any questions or concerns.*",0,1
relationship_advice,No one has anything?,0,1
politics,"&gt; A lot of my co-workers make less than me and throw a fit about 15 dollar minimum wage which makes no sense because they would get a raise in that scenario but they feel like they should get more than a retail employee or fast food worker. Personally I couldn't care less what someone else is making if they are doing better good for them.

For all the ridiculous things people blame for society's ills, I think this right here is the root of so many problems. People vote against their best interests because they're too worried someone they consider less-deserving is going to benefit more than them. Politicians and billionaires thrive by exploiting this ugly instinct.",0,9
relationship_advice,She did tell you so take that into consideration but did she mention that this guy has strong feelings for her?,0,1
politics,"Trump wasn’t at the tower meeting.

You’re lying.

Trump never received Russian help. You lied about that.

The Russians were never pro Trump. That’s a lie.

And you don’t care about unamerican interference, and you’re lying about that.

Hillary Clinton made deals illegally with Ukraine, and was a big part of her hardline stance for escalating the war in Syria. So the Russians had a silly plan to posts memes on Facebook to injure her campaign. Trump winning was not their goal, it was stopping Hillary because they didn’t like her. I don’t like her either. Am I a Russian? 

You need to put this insane conspiracy to rest. It makes you look dumb.",0,1
nba,"My bad, forgot I was in r/nba lol",0,2
freefolk,This needs more up vote. Make it main post.,0,1
politics,"I see no evidence such a letter exists let alone the actual comments in the letter.  This is a report of a report based on anonymous sources.  For me to call on Barr's resignation, the letter would have to exist and show that Barr either broke the law with his summary findings or lied about the findings of the Mueller report.  

I'm not ready to call for his resignation just because Business Insider says the New York Times says some people said a letter exists.",0,0
nba,Giannis they don’t call travels on me anttwntonokfofof,0,-22
relationship_advice,I mean it is thoughtful but ultimately breaking up so I doubt it's fishing..,0,3
relationship_advice,"You're awfully fixated on this one word. It's not about the word he used. If he called her stupid and useless it would be as bad. It's about the fact that he has so little respect or love for her that he could spit out insults at her without hesitation.

He intentionally hurts her, over and over. He demeans her and tries to convince her that it's her fault.",0,5
freefolk,Jon held onto the horns.... That Dragon would have done the exact same shit without Jon on his back....,0,1
politics,"Hello `dacian420`, thank you for participating on r/politics. The topic of your submission is currently being discussed at length in our [megathread.](http://redd.it/bjaxml)  Given the large scale nature of this news, We are temporarily removing all submissions concerning this topic so that the community has one easy to find place for discussion and news updates. Thank you for your understanding.

If you have any questions about this removal, please feel free to [message the moderators.](https://www.reddit.com/message/compose?to=/r/politics&amp;subject=Question regarding removal due to megathread by /u/dacian420&amp;message=I have a question regarding the removal of this [submission.](https://www.washingtonpost.com/world/national-security/mueller-complained-that-barrs-letter-did-not-capture-context-of-trump-probe/2019/04/30/d3c8fdb6-6b7b-11e9-a66d-a82d3f3d96d5_story.html?utm_term=.e2002cad6c9f?context=10000\))",0,1
freefolk,"I will be so fucking done if it's one of those ""WE ARE THE AZOR AHAI"" this is like CW level of cringe.",0,173
gameofthrones,"**Spoiler Warning:** All officially-released show and book content allowed, including trailers and pre-released chapters. No leaked information or paparazzi photos of the set. For more info please check the [spoiler guide](/r/gameofthrones/w/spoiler_guide).

*I am a bot, and this action was performed automatically. Please [contact the moderators of this subreddit](/message/compose/?to=/r/gameofthrones) if you have any questions or concerns.*",0,1
politics,"&gt; she's not the most inspiring politician

Need to listen to her speak. She's pretty damn good with the story telling. She's improved over the past few years too. That's why she's picking it up on her current tour.",0,7
worldnews,"Well, it's written in crayon, so it's pretty difficult to make out the numbers.

Realistically, I think it's just that Trump doesn't understand and he likely hires really shady tax accountants, which is the reason why according to him he's ""always being audited, every year"".  The IRS doesn't audit people repeatedly for shits &amp; giggles, the IRS audits people repeatedly if their tax filings don't add up.",0,4
nba,Livingston is so fucking trash,0,2
gameofthrones,Who said Valyrian Steel is made with dragon fire?,0,1
relationship_advice,"I'm 22 and a virgin, it doesn't make you less of a person. Sex is only a part of the relationship, not the whole thing.

I've never really experienced depression, so I can't speak on that. But I don't think you should view yourself as less attractive to the opposite sex because of it. 

I'm sure if you go out and just meet some new people, you'll find someone",0,4
worldnews,Which one of you is supplying bike locks?,0,1
worldnews,Anyone with a brain.,0,-6
nba,It just shouldn't be a foul period. I get it was designed for player safety but the way harden and players like harden abuse it is honestly ruining the game. Officials should just not call it at all unless someone is absolutely mugged,0,1
politics,"&gt; I'm led to believe that Republicans don't have an issue with crime per se, provided it's committed by a citizen.

You are 100% correct.  They abhor the idea of a crime being committed by an immigrant and will throw massive amount of money at it before they will at any significant other statistic.  If it came down to you could spend 10 billion to reduce immigrants, or 10 billion to reduce traffic fatalities, they would pick to spend it on stopping immigrants every single time.",0,6
politics,"Are you crazy? Trump literally wanted war with Venezuela months ago.

He just said ""all options are on the table"" regarding Venezuela less than a day ago.",0,2
worldnews,[The best kind of correct!](https://i.kym-cdn.com/photos/images/original/000/909/991/48c.jpg),0,2
relationship_advice,"Or even just talking about the food, like if you’re out for Italian and you’re eating chicken parm, bring up a place where you had chicken parm in the past that was super good, preferably a place you vacationed to and start talking about that, and then branch off to places you hope to travel in the future, just let it flow organically",0,1
worldnews,"Acknowledging the realities of a globalized economy is not disdain, failure to acknowledge it is utopianism or just normal old fashioned ignorance. Things don't cost the same everywhere, no company can stay alive deliberately overpaying for anything, so they'll do business where it's cheapest and where they make the best profit. You don't have to like it, it's just true, and inevitable.

I'm glad you ""tried"" to pay your employees above average and I just straight up said I wish the workers in Mex/US made more and lived better, so take your smug, self-righteous bullshit and blow it out your ass.

Ed: there's no bragging in saying ""I make about the average salary for my state and save/invest a lot of it.""",0,2
freefolk,I haven't seen anyone else call her Mary Sue except the numerous people making the strawmen.,1,-1
nba,Harlan asked which finger he dislocated and the floor reporter said his left middle one.  Reggie commented that's the finger he normally points towards Kevin.,0,1
nba,"I mean, you can’t really fault them for it. He’s a very good player and is pioneering the 3-point shot increase",0,8
nba,"A related note: the official TNT site is dogshit. All the official, legal streams have problems. This is really stupid. 

I have to use a pirate stream because the stuff I paid for doesn't work as well. But I'm done trying to use the official streams now. They just cut out too much and have too many issues.",0,11
freefolk,"I love the Unsullied as much as the next guy, but they weren't exactly going to live on as a group of people, being unable to procreate....",0,4
relationship_advice,"You've only been dating for a few months, you don't even know her well enough to say if it's out of character for her or not. I mean, ""I want to go on a week vacation"" isn't out of character for anyone that isn't a hermit. It's normal to travel, and it's normal to take a week long trip somewhere every now and then. And she should before she gets out into the real world, where she won't be able to as easily.

Honestly, it's a huge red flag you're this distraught because your six month girlfriend is going to be gone for a week. That doesn't bode well for you. Especially since ""I'm worried about your *safety*!"" has long since been a dog whistle line for ""if you're not by my side, I think you're going to cheat"" used by men for ages. I know plenty of women that have dealt with that exact same line, it's not exactly subtle. As if a woman her age can't take care of herself on a trip without her man there to hold her hand. Come on dude.",0,1
politics,"It wouldnt take ""lawyers"" if the congresspeople actually deferred their time as a block *to the lawyers already sitting in congress*.",0,2
freefolk,"she literally got stabbed and then got up like nothing and killed her attacker like the wound was nothing. she never struggled. thats why she is a Sue. A non Sue is Brianne. A non Sue was lady Stark. A non Sue is Cersei. Characters with power and obvious weaknesses. Arya's weakness is what? She is not sassy enough? She spent some time training with two idiots, fighting with a stick, now she is the best assassin in 7 kingdoms. At least Arya should have used an opening created by Theon. That could have been better. But no. A Sue needs no help.",1,-1
worldnews,"Next ask yourself why all the news sources you see won't mention the concerted economic attacks on Venezuela from the West for the last decade or so. Rich countries strangling and stealing from a poor one.

Sigh. I hate mentioning this because it makes me look like a pro-Maduro stooge or something. I'm not, he's a dick. But the full story is not being told and it's more complicated than it looks.",0,7
relationship_advice,No she didn’t and that is a really good idea. Thanks,0,2
gameofthrones,"I kept thinking she was going to show up in the last seasons. You know, not really dead. But would she be buried in the crypt anyway?",0,2
worldnews,I dont know enought about the nitty gritty of the situation to agree or disagree. I appreciate the perspective though.,0,1
politics,"
As a reminder, this subreddit [is for civil discussion.](/r/politics/wiki/index#wiki_be_civil)

In general, be courteous to others. Attack ideas, not users. Personal insults, shill or troll accusations, hate speech, **any** advocating or wishing death/physical harm, and other rule violations can result in a permanent ban. 

If you see comments in violation of our rules, please report them.

***


*I am a bot, and this action was performed automatically. Please [contact the moderators of this subreddit](/message/compose/?to=/r/politics) if you have any questions or concerns.*",0,1
freefolk,If you would check the NK's instagram you'd know it does crossfit so duuh,0,67
relationship_advice,"I wouldn't wait a full week. I'd probably wait 2 days. 

Something along the lines of ""Hey, we matched on $APP, and I saw that you don't use it as much as this. I was interested in chatting, so I thought I'd talk to you on this. What's up?""",0,1
nba,what a flop by curry.,0,2
freefolk,"&gt;HE entered the cave after all of the major threats (COTF) were dealt with.

Wrong again. The COTF are throwing magic bombs, light the fire around the entrance and then retreat into the cave. He just walks straight in AT THE FRONT.

Later you do see a single WW walk into Broodraven's actual section by himself - clearly indicating that the WWs are splitting up and searching the cave.

How does he know there wasn't a COTF hiding by the entrance to stab him? How does he know there weren't more people who could kill WWs like Meera does to one of his lieutenants. You're stretching so hard here.

&gt;He wasn't smug or anything.

You're being deliberately obtuse. You don't see ANYTHING in that body language???

&gt;Yeah as being extremely careful,

Yep, EXCEPT when it came to taking out the Three-Eyed-Raven. 

&gt;he was completely surrounded and in no way Arya could sneak or sprint by.

She didn't, she got caught. Her stealth wasn't enough to kill him, just enough to get into arms range.",0,1
relationship_advice,Thank you! This is very helpful 🤗🤗,0,1
freefolk,He just was just leaving a sign showing where he was going to the tree.,0,1
nba,"God, the uproar over hypothetical points. Imagine if the officials blew 27 calls in a row.",0,1
relationship_advice,"I find it hard to believe this is the 1st time she's treating your children badly. 

Spend the day with your daughter. And while you're at it, try and think about the reasons you married someone who can't treat your children as a part of her family.",0,1
freefolk,"I don't mind the war with Cercei after the Great War, I don't mind Arya killing the NK. What I hate is lack of depth, rushed episodes, great villain quick and cheap death. GRRM's books are epic, show used to be epic, few years before.. 
He should have taken almost all the Westeros, going to conquer Essos, etc, should have won in Winterfell, the final battle with the NK should have happened in Kings Landing - Arya could kill him there, they even have a Godswood in KL. Would be great if they showed NK is a great threat for the whole humanity, it took USSR 4 miserable years to win Hitler - that was a threat, they didn't even win in the 1st battles. 

And after that back to that old Westeros with it's Iron Throne wars - that usually happens in real life even after great wars,people are people)",0,4
worldnews,"Which kind, American or Association?",0,1
freefolk,So Tomund G bot? Bobby b bot?  Any others?,0,1
nba,"Lmao, Shump is so brick",0,2
nba,That's pretty fucking high.,0,205
politics,"I was thinking, for example, ""Well, I know that \*some\* people were unhappy and I know that  Mueller wrote me this letter expressing some frustrations. But do I know if the reporters who reported those pieces were referring to any of the specific instances that I knew about? No, I don't know that because the reporters didn't name their sources or cite the Mueller letter specifically.""",0,1
politics,Every friendship is one fight away from being over.,0,3
nba,Can't blame the refs for this one. We played like shit in the third quarter.,0,14
nba,I hate that offensive players can just charge right into defensive players like that. That’s so wrong. Should be a no call at most,0,1
nba,"Well at least it’s close, two injured all stars sucking ass. We have to watch rivers act like he is really an all star",0,1
relationship_advice,"No need to get defensive, I'm just sharing my thoughts (and personal experience with the iud).",0,1
relationship_advice,Never lived in barracks yet I still fart.,0,0
politics,Is someone going to ask Barr if he colluded with Trump to spin the letter summary of the Mueller report.,0,14
freefolk,Are we just gonna ignore 'The Little Bear with Huge Balls?',0,1
worldnews,"Yup.

In this case even a very dumb clock like The Guardian can be right once a day.",0,1
relationship_advice,It’s almost all men it seems,0,-5
freefolk,There must be some unfortunate guy that got burned by the Dragons breath right?,0,1
politics,Your really good at this,0,1
relationship_advice,I mean that pussy fuckin' stank so bad he gave her half his shit.,0,9
politics,What do modern day Hispanics and blacks gain from supporting a white supremacist ?,0,-2
nba,This entire game was presented terribly... I hope we don't get either of them for the rest of the playoffs,0,5
politics,"[""Hey, they're working! My feet are soaked, but my cuffs are bone-dry! Everything's coming up Milhouse!""](https://www.youtube.com/watch?v=PNXIEdS6Sc8)",0,3
freefolk,Chaos is a ladder,0,2
worldnews,You can’t just throw around the balance of powers like that you goon. Congress can impeach whatever they want and the special counsel is under the DOJ which means it’s up to the AG to decide that.,0,3
worldnews,"This is the best tl;dr I could make, [original](https://www.aljazeera.com/news/2019/05/puts-pakistani-armed-group-chief-masood-azhar-terror-list-190501152953396.html) reduced by 76%. (I'm a bot)
*****
&gt; The United Nations added Masood Azhar, leader of a Pakistan-based armed group, to its list of &amp;quot;Global terrorists&amp;quot; on Wednesday after China lifted its objections to the move.

&gt; The UN sanctions committee on the Islamic State of Iraq and the Levant and al-Qaeda announced in a press release the designation of Azhar - the chief of Jaish-e-Muhammad - over his ties to al-Qaeda.

&gt; The sanctions committee accused Azhar of &amp;quot;Participating in the financing, planning, facilitating, preparing, or perpetrating of acts or activities&amp;quot; carried out by JeM. UN diplomats said the request was again submitted to the committee and China had not opposed the move to blacklist Azhar.


*****
[**Extended Summary**](http://np.reddit.com/r/autotldr/comments/bjl1mw/un_puts_pakistani_armed_group_chief_masood_azhar/) | [FAQ](http://np.reddit.com/r/autotldr/comments/31b9fm/faq_autotldr_bot/ ""Version 2.02, ~397195 tl;drs so far."") | [Feedback](http://np.reddit.com/message/compose?to=%23autotldr ""PM's and comments are monitored, constructive feedback is welcome."") | *Top* *keywords*: **Azhar**^#1 **India**^#2 **Kashmir**^#3 **Pakistan**^#4 **JeM**^#5",0,1
politics,Eh knob head....FY too,0,-5
politics,Wow.  That is really spot on.  The thought of a triangular engineer ruler just gave the shivers.,0,3
nba,Ball got knocked out by curry and he caught it,0,1
relationship_advice,I totally get it. I’m  just gonna ignore her and go find some other good looking girl who is into me specifically on a night out in a bar we both go to. I honestly hate that I realise how much of an idiot I’ve been.,0,1
relationship_advice,"Communication is important, if you have to repeatedly ask to talk about something that is bothering you then the relationship is doomed from the start. If someone refuses to communicate then they are likely not worth your time, though sometimes it can be possible they just need to wait a while before talking about the subject and are not currently ready.",0,2
worldnews,Maybe you're next up for being turned into a meme. Would give Scotland our well deserved break from bullshit fake Scottish memes.,0,30
freefolk,I actually think Tyrion likes the idea of breaking the wheel more than Dany at the moment.,0,1
nba,Scott Foster talks to Durant.,0,1
relationship_advice,"If you want my advice I would truly ask yourself the following:

1. Do YOU truly want to be with him? Not do other people think you should or shouldn’t be, but do you want to spend your life with him still even after what was done.

2. If the answer is “yes”, then what does he need to do in order for you to truly want to be with him still. Other than the obvious not call you names, look at other women. Think of things YOU want from him. It can just be attitude adjustment to little things like maybe a foot rub every now and then. You say you always please him sexually, so what do you want, you are a team remember.

3. What are you willing to compromise on? Can you honestly forgive him for what he said? Would you be able to possibly do a date night more, things like that. 

4. If you think you want to make it work, maybe see a couples therapist. Myself and everyone on here are just random people with know actual professional opinions. It might be a good idea to get one if you honestly might want to end your marriage.

No matter what you choose, I hope you find happiness and are treated better OP. Good luck to you.",0,1
politics,"But he was BLACK! DON’T YOU UNDERSTAND?

/s",0,4
freefolk,I feel like the characters have somehow managed to under go a 'flandernization' in the last season and it sucks that this may be the last memories of them that we have.,0,2
worldnews,"&gt; Capitalism is the best economic system to fight climate change.

The thing that created the problem through over production and consumption and a built in economic inability to include the externalities in the price is the best thing to solve it?

That's a nice little flourish that'll give everyone a giddy laugh, but its sorta nonsense.",0,-1
freefolk,"I didn't think of this scene, [but I thought about the scene in the massage parlor](https://www.youtube.com/watch?v=2qKoFdPJ4rI) from RH2...",0,2
gameofthrones,I know what you mean,0,1
politics,"Ya man I had like a thousand plastic bottles at one point, they took it at recycling spot and got paid cash on arrival.",0,2
freefolk,Actually bran was as responsible for the knight kings death as Arya because he never exposed himself he always stayed behind the army of the dead . Without bran they wouldn't have been able to get to him.,0,4
nba,Lol nothing like random ass spurs fans(seriously what rivalry has SA ever had with fucking Boston) hating on us for losing to one of the best home teams in the league,0,0
politics,"By ""something"" do you mean the FBI and Special Counsel investigations he repeatedly tried to hinder and/or end?",0,2
nba,Man why are they going to show Allie LaForce and then immediately switch to a close up of Gordon. Almost gave me a heart attack,0,1
gameofthrones,Would you look at the free thinker over here,0,3
politics,Barrs initial statements where meant to get ahead of the narrative in this day and age the first to deliver there message is the one that gets to set the truth. Both barr and Trump need to testify in front of Congress so the world can watch them try and lie there way out. Sadly though i don't think it would change there fan base opinion much but maybe we can get those on the fence to finally see the light.,0,2
gameofthrones,"&gt;No, where did you get this idea?  

https://i.imgur.com/IyGYahs.jpg",0,6
worldnews,"Anti-rhetoric, getting all the facts, understanding why some, not all, do something.

Call it what you want.",0,1
gameofthrones,"People don't seem to remember Jaqen H'ghar was at the top of a rock on a high and steep fucking hill, and seconds later he re-appears behind Arya without her noticing.

Arya displays the same abilities and people start throwing a tantrum because it's not realistic.

Pathetic.",0,2
worldnews,12.5 months? Do you mean one year and a couple weeks?,0,1
politics,That's not how Law works.,0,3
relationship_advice,"Personally I would say “I’m really sorry. I want to talk to you and tell you how sorry I am but I understand, and respect, that you need your space. I really want to work this out and I’m here if you want to. I love you and I would never do anything to jeopardize being with you. I hope you have a great day.”",0,1
politics,"
As a reminder, this subreddit [is for civil discussion.](/r/politics/wiki/index#wiki_be_civil)

In general, be courteous to others. Attack ideas, not users. Personal insults, shill or troll accusations, hate speech, **any** advocating or wishing death/physical harm, and other rule violations can result in a permanent ban. 

If you see comments in violation of our rules, please report them.

***


*I am a bot, and this action was performed automatically. Please [contact the moderators of this subreddit](/message/compose/?to=/r/politics) if you have any questions or concerns.*",0,1
gameofthrones,What if Arya Killed him while wearing a mask of a man?  One could argue at times that Arya is genderless because of her 1000 faces.,0,2
gameofthrones,Well then they shouldn't have killed off Olenna or Stannis then either by that logic,0,1
gameofthrones,Gotta get a coffee and cig in my hands before I watch this.,0,0
politics,Hmm interesting example. Wonder how Mueller meant it.,0,6
politics,What are the odds on whether or not he actually shows up?,0,8
worldnews,Whats wrong with that?,0,0
nba,"NBA are cowards. Notice how they gave Curry and Harden injuries that made them go back to the locker room, but not bad enough to rule either out for the game. 

I haven't seen writing this convenient since Game of Thrones.",1,3
nba,Why don't you flair up? It does seem that you're a Celtics fan so that explains your shit behavior and i bet you're a fucking racist too. I hope all your good players leave your team.,0,0
worldnews,So? Weight of the vehicule ain't the only thing they've got to think about.,0,1
