subreddit,body,controversiality,score
freefolk,"Because Ramin is a funkin legend. Hahaha 

But nah, cinematically speaking I think you have to have music at some points or it becomes too much straight battle and battle noises, which can become monotonous. I think, especially at the end where the NK makes it to the godswood and everything seems to stop as he approaches Bran, there needs to be music there. Same with Jorah making a last stand to defend Dany. Otherwise, it would be too quiet. Just wouldn’t fit. And the music choice, spot on in my opinion. 

Again, this is just my two cents. I fall into the aforementioned category of having no clue about script writing, directing, etc. 

Here’s a link to a cool video where they talk about a lot of what went on behind the scenes: 
https://youtu.be/_3M0Xt97aFI

Kinda long but worth the watch if you’re interested.",0,1
gameofthrones,"First i thought they did it because it costs less money to shoot cgi in darkess, i was high af tho'.",0,2
gameofthrones,"[NO SPOILERS] means any comments with spoilers need to use spoiler tags to cover the information. Show tags are black. Book tags are red. Game tags are orange. For more info please check the [spoiler guide](/r/gameofthrones/w/spoiler_guide).

*I am a bot, and this action was performed automatically. Please [contact the moderators of this subreddit](/message/compose/?to=/r/gameofthrones) if you have any questions or concerns.*",0,1
worldnews,Imagine calling a US backed coup “Democratic”,0,-5
freefolk,You have to feel for Jon.,0,24
relationship_advice,"&gt;She recently got out of an abusive relationship....

&gt; you are just so sweet caring and such a fun person also can't forget funny and yeah I really did/ do like you.....

It sounds like you're the rebound or an attempt to atone for her abusive relationship. Nothing wrong with proceeding, but proceed with caution.",0,3
freefolk,This makes me laugh every goddamn time.,0,5
politics,"
As a reminder, this subreddit [is for civil discussion.](/r/politics/wiki/index#wiki_be_civil)

In general, be courteous to others. Attack ideas, not users. Personal insults, shill or troll accusations, hate speech, **any** advocating or wishing death/physical harm, and other rule violations can result in a permanent ban. 

If you see comments in violation of our rules, please report them.

***


*I am a bot, and this action was performed automatically. Please [contact the moderators of this subreddit](/message/compose/?to=/r/politics) if you have any questions or concerns.*",0,1
nba,"Well if you knew how much money he has, assuming the clippers franchise was suddenly worthless, he could gain that money back on a good stock market day. Ballmer don't give a shit.

This whole post is about people thinking Ballmer will move the team so why are you on this thread if you're not talking about that.",0,1
freefolk,"It's so idiotic it's incomprehensible.   From the start of the battle i was just like....wut...?

It wasn't a strategy at all, It was just chaos.",0,2
gameofthrones,The Dothraki live to fight; The Unsullied live to serve,0,2
freefolk,yeah the mountain is supposed to be old af but they were retarded enough to fire the first Mountain actor who was perfect the role so we're stuck with some young fat ass who can't act (which I guess is fine since the character no longer is able to speak).,0,2
freefolk,"I honestly don’t even count Bran among the «surviving people » of the Stark clan. I adore him but that’s not Bran. So for he won’t he won’t die since he is technically already dead and has been since that night in the cave. 

I expect him to go back to his tree or something tbh",0,1
worldnews,"&gt; Buy a plane ticket and look at how much the actual fare is compared to the tax, I bet it is a third or less.

The average ticket tax is 15%. Many airlines bundle ""fuel fees"" and other fees with these taxes to make the base ticket price appear lower.",0,7
relationship_advice,That would make you the pimp!,0,4
worldnews,An Extradition Trial to see if he fulfilled our requirements to be sent to Sweden for Sexual Assault and Rape Charges.,0,16
relationship_advice,"Reading yo’ diary and hacking yo’  emails? THAS A DEAL BREAKA, LADIIIIIIIES!!!",0,2
relationship_advice,"How is she not an adult? I'm a 19 year old girl, I'm pretty damn sure I'd be pissed if someone assumed I wasn't ""adult"" enough to make my own relationship decisions based gender and age, like OP is.",0,1
worldnews,"My dad was a Catholic, and judging by how much it screwed him up, and my own experience with that religion, all I can say is thank God I am not one (anymore).",1,0
worldnews,"No. But when politics come up, the rest of us watch American News (a worldwide sitcom) and we all adore you. Honest.

My favourite part is when the lower half of the country with the funny accent tried to let gays get banned from cake shops but then cry when a conservative gets banned from social media or a convention and didn't even get that they were the butt of their own joke!

Your script writers are great at irony. Especially the guys who write the lines for the far-right guys who live in poor colonies in the desert.

You guys are a fucking hoot. You guys even kill The Brits in ratings, and they're fuckin' around, making us laugh  a whole lot lately.",0,4
gameofthrones,"You really capture the essence of the moment...     

The quizzical look on the face of the Night King creates a fabulous juxtaposition to the smirking un-killable firewalking godlike undead creature that we saw just moments earlier.  
  
 It’s really speaks to me..... and it says “Surprise dummy!”",0,2
worldnews,"I am in the best financial position of my life, I am a homeowner, just got married and we have a household income over 6 figures. I happen to be a Trump supporter. Weird. 

Hope things get better for you though. Unemployment is very low, which is an indicator that demand is high right now, you should be able to look around for a better job.",0,-8
freefolk,"Yes, it would have been great because now we wouldn't know who to cheer for. However, I would've had some survivors from Winterfell beg Cersei to join her and create some more tension as everyone is being closed in on by the AoTD.",0,2
freefolk,The bad pousey got to him.,0,140
nba,KD just made a retarded contested 3,0,0
politics,"It appears Liz is the most qualified candidate on the stage right now. But I worry she probably wouldn't be very effective unless she had a supermajority and that's where the Democrats are completely unprepared. They're not even trying to win anymore. Leadership's asleep at the wheel drooling, busy helping the opposition rape the nation. Which side are these motherfuckers on anyway? Anyways...

[But what's her deal with Medicare for All?](https://www.youtube.com/watch?v=VCccbSi7XS8),",0,1
worldnews,"""The spice must flow!""",0,1
nba,Holy fuck shut up,0,6
freefolk,Stick man lived in the family tree.,0,1
freefolk,They technically won the battle.,0,2
worldnews,"The CCP has lifted hundreds of millions of people out of poverty and ushered in an age of economic growth in China. The *average* Chinese person doesn't give a shit about censorship or the social score.

Realize that for thousands of years, Chinese culture has been about doing what is best for family, community, and state at the expense of the individual. Their historical and mythological heroes are empire-builders, not rebels. There is no culture of political dissent.

They have healthcare, though.",0,4
relationship_advice,"We’re going at it big time now. He confirmed that he is watching the girl that he works with. Then told me the reason why is because I’m boring. But says he is wanting to fix this. Fuck him. I get nothing but disrespect all year, now he’s watching some girl and says he’s just a man. I hate him.",0,5
politics,"And even if you grant those fuckers that cheating on your wife is worse than corruption or treason, Stormy Daniels would like to have a word with them....",0,1
gameofthrones,"No problem, it made me so sad to see him go, he fought so hard to protect his love and queen. May you rest in peace!",0,5
worldnews,"And the sky is falling too, you forgot that.",0,0
worldnews,"Yet people are still insisting that it only happened because Ethiopian pilots clearly aren't being trained well.  This despite an investigation clearing them of fault, no discrepancies noted in their training, and black box recordings indicating the pilots did everything they had been trained to do until the moment they died.

Boeing murdered hundreds of people, and the US government is doing everything in their power to ensure Boeing sees no repercussions.",0,508
gameofthrones,im not subscribed but i think he has a few million subscribers and its exactly how i felt about the episode,0,1
nba,"Unpopular opinion : in 3 years Giannis is going to be as much hated as harden because he will shoot +10FT, he travels as much and pushes off a lot of times. He’s still one of the best players rn just an opinion",1,2
gameofthrones,"yeah, you could be right. I just got the impression it was driven by emotion more than logic.",0,3
gameofthrones,"The plot armour stuff hasn't always happened though. It started once the show overtook the books. The show keeps on writing their characters into situations they shouldn't ever survive, but they do survive and that's what people have a problem with. Mistakes used to have consequences, now they don't.",0,2
nba,"Aight I guess we’ll see lol, flair up also as I doubt you’re a Celtics fan who’s been keeping up with this shit",0,1
worldnews,"I’m fightin for my life here!

-Donald J Trump.",0,761
relationship_advice,"The ending you talk of has been repeated on so many posts on this sub and AITA subs, posted by a throwaway as is the tradition. Every Op has their relationship broken with an ex that ends up hooking up with a heavy drug user that happens to be a Nazi/anti-vaxxers/MLM whores... The list goes on but generally: garbage of a person. It's either that America is fucked or scripted posts are going out of hand lately.",0,4
worldnews,What your missing is just that the media and the politicians they serve lie.,0,-2
politics,"I have to agree. This president is made of teflon for some reason and I cannot understand how he gets away with everything.

Think about Howard Dean yelling with excitement about his election campaign and that was his downfall. Then Rick Perry was the ""Oops"" moment.

This guy talked shit about McCain in the beginning and shat upon all POWs says he likes his heroes that weren't captured.",0,15
gameofthrones,"Different approaches. I don’t disagree that it was too dark, but Helm’s Deep isn’t just bright compared to the Battle of Winterfell, it’s just bright in general.",0,1
freefolk,"Yes! That's exactly what I said above. The show Arya's miraculous transformation is just really poor writing and I blame the showrunners for this, and she is a ""Mary Sue"" now only because they are really poor writers who couldn't resolve the story any other way. Who else would be to blame?",0,1
freefolk,"Why move at all? He took a dragon down from what, a 1000 feet away? Why not just throw the sword at Bran?",0,21
worldnews,"For obstruction it would have to be taken a step further and show malignant intent of the President.  Barr furthers, it isn't corrupt for a president to know he is innocent and be upset by an investigation trying to prove that he is guilty.  ""That doesn't fall into malignant intent"" -BARR",0,0
nba,"Between this and pizzagate, it's really hard for me to look at him on the bench.",0,2
worldnews,"Currently playing an alcoholic, can advise. You get to do a lot of fun angry scenes, but the afterward depressed crying scenes mean your crying on command game needs to be on point. There’s also a serious risk of landing on the undesirable spin-off, Netflix Presents: Dude on Trial for Something",0,4
relationship_advice,"I think you are completely correct. The youngest sister is 24, the only child I'm related to is the infant. There are children in the church and I think one has been exorcised.

I'm looking through therapist sites. I think we may organise a consultation at least.",0,2
worldnews,"Read the quote again. Mueller said that if he could find the president innocent of obstruction he would, but he can't based on the evidence.  

It is clear what he means.  If you're reading something different, that is your bias.",0,1
nba,Yeah he elbows and travels every time but is never once hacked in the post,0,1
relationship_advice,"I honestly think he really is just joking. Me and my wife joke around like that often enough. But she plays along with it. It is meant to be humorous and harmless. Ours is typically the other way around. 

For instance I'll have several different colognes. She has a favorite but I personally favor a different one. So she will tell me you smell nice and ill say yeah my girlfriend really likes this cologne but don't tell my wife. And then she will kiss me or something and say as long you don't tell my boyfriend about that. 

Try joking back with him. You will find out real quick if he is truly trying to be being humorous. So next time he says why does it smell like another man in here simply say you didn't think you were the only one. Or something along those lines.",0,-3
nba,We don't even realize that this is the last hurrah for the Warriors. The team's moving to San Francisco and it's best player/hired gun is moving to New York. Golden State doesn't finish top 4 in the West next season. Save this.,0,-15
politics,"He was referring it to Congress, you fucking boob.",0,5
gameofthrones,What a bunch of annoying hipsters.,0,6
nba,He does that all the time and when the refs dont fall for it he gets his front office to complain lmao a true pos,0,1
politics,Ha! You got us!,0,5
freefolk,"He already did...in the bathtub. Old Jaime died there, that was his moment of transformation. 

In the books, he parts from Cersei a lot earlier and runs off with Brienne.",0,3
freefolk,"There are three episodes remaining in this season. HOPEFULLY TNK will come back and raise hell in King's Landing. That'd be something--next episode somehow he comes back and heads to King's Landing for Cersei's army.

I remember hearing that there was snow or something in King's Landing towards the end of the season (the final episode), so I am hopeful.

Also wasn't there a leaked image where TNK was in a mirror or something in a room in Cersei's castle? In a room that Tywin was commonly seen in.",0,1
gameofthrones,"I'm also crying, the Onion Knight must be close by :(",0,4
gameofthrones,"That’s why I wish they would’ve wrapped up the iron throne storyline last season. I mean, the very first scene of the show is a white walker killing rangers, but we are ending on who has power instead of the living vs the dead.",0,1
politics,"&gt;He could have charged Trump. There is no law saying the president can't be indicted.

Wasn't his job. That's for Congress to do. Whether or not you agree with Mueller tasking Congress with fulfilling their duty (hint: the Republicans won't) is another matter. After Comey's influence on 2016, it is easy to see why he wanted to follow procedure. To deny the Republicans the ability to twist his actions against him and the nation. There is no law, but why give them ammunition if you don't have to?

&gt;He could have interviewed Trump. He couldn't be bothered.

You don't know what his agenda looked like before it was obviously cut short by Barr's fuckery. Something of this magnitude requires strategic moves, and he may have been out-played on that battle, but it doesn't seem like he needed it anyway if you read the report. More than enough to nail Trump's flabby ass in there. 

&gt;He could have interviewed Jr or Kushner and thrown them in jail for all their crimes. He let them off completely.

See previous. You still don't know what all was handed off to NY. The folks who actually can make moves Trump can't pardon away.

&gt;So no. Muller didn't do his job. He is not a patriot.

He did his job exactly as he said he would. Sorry that doesn't line up with what a lot of us wanted? We've never had the full picture of all the plays in action, and as nice as a simple quick solution would be, it's still bigger than we can wrap our heads around with the information we do have. This is a massive clusterfuck and tossing the figureheads in jail won't solve any issues and would very easily create more problems which have the potential to be even worse for much longer.",0,2
gameofthrones,"Actually plenty do, it was poor strategy.",0,7
nba,Yikes Curry can't shoot,0,3
relationship_advice,"As I said originally, this is a simple concept that many people still manage to fuck up. You are one of those people. Maybe you will eventually learn this lesson or maybe you won't. Either way, I wish you luck.",0,1
politics,"I feel like seasoned prosecutors on the judiciary committee like Kamala Harris ought to be able to break liars under questioning like it's second nature. And yet, they always pull their punches.",0,6
worldnews,"There's a difference between a consequence and an explicit motivation. Unless there's an interview I don't know about, it's pretty ignorant to claim Fox News was *specifically* founded to prevent impeachment.",1,2
gameofthrones,There were colors? Who would’ve known. I only saw a night very dark and full of terrors,0,11
relationship_advice,"Very true. We did set a clear boundary of not sleeping with others, however. I am also disappointed by how long she took to tell me as well. I could have otherwise moved on more quickly and feels disrespectful.",0,1
worldnews,Literally all of these things are available without dairy.,0,6
worldnews,Now thats how things are working out right now and the Left is continuing to do just that.,1,2
nba,I foreal thought harden was gonna come back with an eye patch,0,6
nba,He’s a bad player who happens to be extremely clutch for some reason. You remember the good moments but he’s really not good at all.,0,2
freefolk,"Beric had like 9 lives, so not really, but I appreciate this.",0,1
worldnews,I'm keeping mine in any case ;),0,7
worldnews,/u/ready2navigate at this time: http://media.tumblr.com/tumblr_mavtr0y2vj1rv0dn9.gif,0,3
politics,"I am 100% sure the tax returns Deutsche Bank has are different from the returns submitted to the IRS.


Source: am a tax professional",0,16
nba,"i think it's an interesting area as you say. i agree they don't support him it is probably the opposite i mean i think lebron genuinely dislikes him but like it or not he has benefited from him winning in more ways than one. and you think lebron who wants to be a billionaire and own a team is interested in bernies tax plan that'll eat 10 mil of his earnings or warrens wealth tax or AOC's 70% marginal tax, no he's not and that's why someone like him who we see dip into politics a lot takes a step back now and will throw his hat in late in the game like we saw 2016. Chuck himself has said in an interview about the topic that things are great if you got money, which of course a lot of these guys do",1,4
nba,Hey at least you traded away your 1st round pick for him,0,1
politics,Because Barr and Trump are spinning the report like crazy. They are attempting to control the “context” of the report and therefore control the “substance” by how it’s interpreted by American voters.,0,4
relationship_advice,"This isn't an advisable situation, because with everything you've put here, you've made it abundantly clear that your husband has been, is, and will be verbally abusive at *least*, and is likely to progress to physical abuse.

Flip the situation: What if you found this post on your home page? What would you advise to that person? Read your post as if it was someone else's situation, and I think you'll see why I'm saying what I am.

I have no advice except to leave him.",0,1
