subreddit,body,controversiality,score
politics,Buttery males!  I know he couldn't avoid talking about buttery males.,0,2
nba,An east coast game at 430 west coast time wouldn't be that crazy.,0,5
freefolk,Oh yea we’ll get this... King Tommen jumped from the tower and landed in... King’s Landing. Bet u never heard that before,0,1
gameofthrones,"It was a great episode, but too often the scenes were too dark with blurry close-ups where you can't figure out what you're seeing.",0,1
politics,Really? Had you heard of Bernie before the buildup to the 2016 election?,0,1
worldnews,"Now we have the moral authority to go to them and push them to do the same. The way it happened over here was local councils started declaring a climate emergency and it spread quickly around the country. I hope it will spread the same way internationally.

Also, we're not doing nearly enough even if we are doing more than other countries.",0,18
gameofthrones,A 30 minute sword fight would get boring pretty quick,1,-2
nba,Alright I'm not crazy that's what I saw too but I wasn't sure he spoke French. Fais attention definitely .,0,75
gameofthrones,Did you think of that on your own or did someone need to tell you that?,1,-2
relationship_advice,"How dreamy is dreamy, and how much less dreamy is your DC job compared to your NY job?  Can the NY job be done remotely?  I have a friend who lives in Maryland and travels with his wife to her opera gigs and telecommutes to a programming job in NY.

TBF the DC job would solve so many issues at once, it seems like the way to go unless it positively sucks compared to the offer in NY.",0,0
gameofthrones,"Bran was apparently warging to attract the NK

&amp;#x200B;

Jon's dragon crash-landed but is apparently ok, is in the next Ep trailer",0,3
politics,"Pompeo is making shit up. The only one who sought to evade anything was Trump (See Vietnam, fake foot injury).",0,3
politics,"As always, they are picking one line from the whole article and treating it like everyone else missed this ever so important detail and therefore misunderstood it completely.",0,4
freefolk,"&gt;Cause they needed as many people as possible and he has at least some experience.

I meant ""story-wise""",0,3
relationship_advice,RUN!!!! RUN FOR YA LIFE!!!,0,1
worldnews,I wish he’d just come out and do a press conf already. Damn annoying at this point.,0,2
gameofthrones,"Have you tried on a computer? A bunch of reactors had their laptop hooked up to the tv and said that they can’t see the tv but can see it when it’s on the laptop.

I watched it in a 70% dark room on my laptop and could see what the episode wanted me to see. It was what I expected a night battle to be like when there’s no moon visible. I was never confused about where a scene was or anything, while the people complaining about the dark said they couldn’t see anything, which is weird and sucks.",0,1
worldnews,The Hunger Games was an apt description of our society.,0,5
politics,Someone let Lindsey know Hilary lost,0,3
gameofthrones,It's almost as if the writers can do what the fuck they want with their own show,0,1
gameofthrones,I'm a professional pirvegel misspell-er. I misspell privlege. I studied at Oxford.,0,1
freefolk,"Theres no way they could have made the NK an interesting or compelling villain, I'm glad he was voiceless and that plots done with",0,1
freefolk,They are. The original one died I believe,0,1
freefolk,"Where Stannis is going in the books is yet to be determined, and R'hllor is notoriously unreliable, especially when it comes to prophecies.

&amp;#x200B;

The House of the Undying shows Dany much of what is to come, but also throws at her things that may not necessarily come true but are shown to her by her own imagining -- Rhaego is a prime example of this, but the visual also shown to her of her silver mare in a forest stream is another that could never possibly come true but is merely derived from her own imagination. Those were not prophecies given from an unbiased source, but rather one who had an active desire to kill Dany and distracting her with such images was a good way to lull her into a false sense of security. We can't take them entirely at face value.

&amp;#x200B;

The Prince Who Was Promised is a legend that has driven other people to madness in its pursuit. It's not some one-off imagined image in Dany's head or some bullshit Mel saw in the flames and misinterpreted. It's something that almost definitely happened in the past, and will happen again, like basically every other legend and myth in the ASOIAF mythos. It was a legend that was created in the wake of the creation of the White Walkers, and some crazy shit had to have happened for them to have had the ability to create the Wall. Unbiased sources have nothing except 100% accurate prophecies in their dreams and in their cryptic statements.",0,1
relationship_advice,"My advice is to play it by ear/wing it but don’t be surprised if she’s just being friendly.

I personally don’t want to spend time on people who aren’t clear with their intentions.",0,1
freefolk,There is no wall and there is not commander of the Night's Watch anymore. And the big bad that that Watch was created to defend against is dead.,0,23
gameofthrones,Well technically it was part of bran’s plan.... but he didn’t tell anyone.,0,1
politics,"Very true, I honestly overlooked this obvious point (honestly didn’t wanna make too broad of a claim I couldn’t back).  

Again, it is so important even incarcerated individuals have a right to vote.  Many people might be rightfully incarcerated but many more are incarcerated as a result of institutionalized racism, unfair lack of opportunities, perpetuating poverty, and abusive policing practices.  These people who are merely a victim of a system stacked against them must keep their right to vote even in prison.  They, above everyone else, have a great interest in seeing change.  Change cannot happen if their voice is taken away.",0,2
freefolk,"&gt; Instead Arya kills the Night King literally the first time she sees him.

I just realized, does she even get a good luck at him before her attack? Imagine her jumping on some other random White Walker that kinda looked important. 

Bran: You were a good woman but not so great assassin.",0,13
nba,"Dude is clearly a hater. If you watched the Thunder that year then you already know. He was incredibly clutch and dragged a depleted roster to the playoffs in the west. 

I know he’s not the goat or anything but the amount of hate he gets is fucking ridiculous.",0,-9
freefolk,That blacksmith deserves a raise.,0,3
politics,Was that the signal to bring papers so he could act uninterested? I missed part of it.,0,1
gameofthrones,"**Spoiler Warning:** All officially-released show and book content allowed, including trailers and pre-released chapters. No leaked information or paparazzi photos of the set. For more info please check the [spoiler guide](/r/gameofthrones/w/spoiler_guide).

*I am a bot, and this action was performed automatically. Please [contact the moderators of this subreddit](/message/compose/?to=/r/gameofthrones) if you have any questions or concerns.*",0,2
worldnews,It’s the UAE.  Most of the moms aren’t working.,0,7
politics,"He is freaking out. He is no billionaire, and the world will know soon. He lives on credit.",0,1
nba,"This is beautiful. Do the Rockets not realize that these games are televised in HD and anyone with half a brain and Tivo can look at the footage and know how full of shit they are?

*Changed . to ? because punctuation is important.",0,1
politics,"And the eternal, never-to-be-answered question is “why?”

Why be at the helm of biased and improper support for a president doing so many things wrong on a daily basis. Why risk ruining your legal reputation to prop up party-over-country politics? Why commit acts that legal professionals twice your caliber are bound to call out? Why support this outrageous, immoral, joke of a president? What does Barr get out of it?",0,1
freefolk,"I know, I think that’ll be their challenge to figure out to work together this point forward. Everyone is going to have to make some concessions and learn how to work together.",0,2
nba,Reading the comments putting down the Bucks earlier is making this nice to watch.,0,11
worldnews,"I don’t think it is. At least prior to the collapse of the USSR you could’ve said essentially the same thing about them.

Either way it’s state power being abused but the abuses may ultimately be for the greater good. It’s yet to be seen what comes from it, other than we know they’re doing typical authoritarian acts but also (as with the others) it’s been a general benefit in at least some ways to the majority. 

It’s worth noting that shitty regimes have done good things in the past. You need to consider whether the State is actually acting for the greater good (and if it will long term), if it’s carrying that duty out effectively, and whether doing so is worth the crushing of the rights and liberties of individuals. I’m not saying modern China is as bad as Stalin, but it’s fair to draw the comparison.",0,0
relationship_advice,"Could your tone have anything to do with it?  I'm less likely to be calm while receiving criticism if it comes off as condescending.  It's absolutely possible to make a complaint to someone's face and be heard and for that person to try to fix the complaint, but results very wildly depending on how you deliver that complaint.  

Also, some things really aren't worth bringing up.  For example, you don't like the way your partner loads the dishwasher so you stand there watching, while it's them doing the work, not you,  and if you're constantly critiquing what they are doing, well that just comes off as rude.  And really, who cares how it's done so long as it's getting done.",0,1
gameofthrones,He already has pierced Cersei without consent at least once.,0,5
freefolk,The main reason I was disappointed was because no1 important died... I miss the good old days where main characters died like flies,0,1
freefolk,Chemistry dude. If you eat pure sodium you will die. If you inhale pure chlorine it ain't good either. But salt is ok.,0,1
gameofthrones,"Would that also mean an end to the three eyed raven aka all of mans memories? If I’m remembering this correctly, Bran had to be trained n shit to become the next raven. Would his successor be lost or would it automatically transfer?",0,1
politics,"Because the root cause of the lawsuit is referring to trump in his position, if he weren't an elected official then emoluments doesn't matter.",0,2
nba,Lol both teams scoring over 200 tonight,0,2
politics,Listing 11 acts of possible Obstruction is pretty conclusive to me.,0,3
gameofthrones,"There might be similarities but I don’t think it’s gonna be the whole “you take him down all the white walkers go with him”. If the legends are true from the books, the night’s king marries the white walker queen, so he wasn’t even the first one turned.",0,3
nba,"Rockets have thrown it away a few times but Dubs are fuckin swarming on D thus far

Intensity has been stepped way the fuck up on that side of the ball",0,1
worldnews,"Imagine spending 2 years investigating and writing a report only to have your boss, who didn’t even have time to read it, summarize it by saying the complete opposite of its content. That’s how Mueller must feel about this whole ordeal. That would suck.",0,155
worldnews,"Isn’t this similar to what the Romans did? I might be off on this cuz it might just be military fortification, but their soldiers were very adept builders",0,1
politics,"Isn't there a crime or isn't there a crime?


Well there's your first problem !",0,3
freefolk,"He explains that by saving him and two prisoners, he owes her three lives stolen from the many faced god",0,2
freefolk,I honestly dgaf about Edmure.,0,1
relationship_advice,"“Um Meghan has the paper work. why don’t you believe me?” 

Pshhhh",0,331
worldnews,Special Counsel Robert Mueller operated under DoJ guidance that a sitting President cannot be indicted. That was never a possible outcome. And obviously impeachment is not possible as long as the GOP controls the Senate.,0,1
politics,"[Direct Twitter link](https://twitter.com/AlexNBCNews/status/1123583403121680385) to the full letter.

Over a month ago, Mueller insisted that his intro and executive summaries be released immediately to the public, with no further redactions beyond the ones his team determined necessary.",0,8
politics,"She needs to think more, talk less.

Right now she is simply aiding trump.

Oh I'm sure this is upsetting to you, but really, she has been in office only 4 moths and there IS a learning curve......and the concept of humility.",0,-11
politics,"I grew up in the Mormon religion.

They prefer their women to not talk. What's not to like about that?",0,1
gameofthrones,"He's also the biggest strength of his army. He's strong enough to insta anyone, has a dragon with a trillion DPS and wall-breaking capability, can raise many thousands of extra troops and is all but immortal. 

Without him distracting the dragons &amp; raising the dead the fight could have been brute force-able.",0,1
politics,As he says in the report the Office of Legal council and DOJ policy would not let him recommend indictment.,0,1
relationship_advice,On the fence about leaving her lol. Don’t be an idiot. Run!!,0,2
freefolk,"Too bad, you planning  on closing out this sub in few weeks",1,1
freefolk,"What do you want from me, u/sonoffire93? Gold? Women? Golden women? Stick with me and you'll have them all, for as long as I'm around and not a moment longer.",0,3
gameofthrones,"take a second and just think about the name ""Dothraki Screamers"". Their ENTIRE tactic is charge, scream (intimidate) and overwhelm. There is a history reference I believe I read in World of Ice and Fire where 2,000 unsullied held the line against 15,000 Dothraki screamers. Had the Dothraki attempted to Flank the Unsullied they would have crushed them but they just kept charging and smashing. Its just what they fucking do! They were also most likely expecting a lumbering force of skeletons and not a crushing 15' wall of death. Had it been just some lumbering force then I assume the fight would look a bit more like when stannis just rode through the wildlings like grass. Night time or daytime wouldnt matter a damn bit especially when they are hopped up on that flaming sword buzz. Also... What the fuck else were they supposed to do? ride around the potentially million strong force that stretches for miles? 

As for the Trebuchets... Someone else up on the post also commented on this but a Trebuchet takes a long ass time to reload and as such would only get 1 or 2 MAYBE 3 good shots off before becoming IMMENSELY USEFUL as an obstacle, for say... a charging dead army? Their placement was ideal. The only addition I could think of was lighting them on fire after with the retreat to illuminate the field but even thats a bit gratuitous. Hate on the episode all you want /u/boredje but it wasnt bad just because you dont understand it.",0,3
freefolk,"This is what I'd expect more than Kyne's Peace.  Definitely Dragonrend.

Just need Esbern/3iR (Max Von Sydow) to voice over as Jon shouts.  ""The one they fear... Dragonborn!""",0,1
freefolk,16 is also the age of consent in the UK,0,1
gameofthrones,"Like 6 or 7 times, right!?",0,1
relationship_advice,"He never thinks of you, just himself and what he wants. He’s selfish, plain and simple. You have to want to share the experience with the person to invite them. You asking only annoys him because he wants you to blindly follow his lead. Personally, I’d drop his ass. To me this type of thinking only bleeding into other aspects, as the relationship progresses you’ll have to stay in your place. Don’t mean to be harsh, but that’s my takeaway. He’s not allowing you to be a part of his life fully.",0,2
relationship_advice,So do you have established issues with leaving the house?,0,3
gameofthrones,Beautiful work! You nailed the eye brows perfectly.,0,1
nba,I was following Bucks games all season. i don't recognize this basura team,0,8
relationship_advice,Can we rename this sub r/obvious_bait?,0,2
nba,This is a defining game for Giannis. We are going to learn a lot about him as to where he is as a superstar.,0,8
freefolk,Didn't DnD get told the ending by GRRM? The NK falling earlier than the end is actually part of the books planning.,0,1
relationship_advice,Right she invited him knowing he wouldn't be able to go. That was her simply blowing smoke. And he actually states that she makes him feel like she still has feelings for him.,0,1
worldnews,"Cool, so they got help from the Russians, they just didnt ask for any. And proceeded to act really suspiciously after winning the presidency.",0,-6
freefolk,"Couldn’t Jon still be Azor Ahai? He did lead the armies of the living and save humanity from the dead, even if he didn’t kill the NK himself and there was no flaming sword or whatever (probably wasn’t one in the first long night, just as the hero didn’t sing away the darkness like they say in some parts of Essos).

Plenty of people are annoyed, but I think GRRM has given plenty of warning for those who jump headfirst into prophecy.

I liked it.",0,2
nba,I'm using reverse psychology... don't ruin it!,0,2
worldnews,"If you read through they where independent before joining the ottomans, they where pretty much a satellite state, the control of the ottomans was by name and alliance every other way they where there own country. The eastern block barely had autonomy at all. Maybe you can link me something that says otherwise?",0,1
nba,Ayesha should withhold the feet till Steph goes nuclear.,0,5
freefolk,Unscrew and throw the pommel at her,0,1
relationship_advice,I caused a guy to pretend to be my partner to cheat on me too. 🙂 I’m probably the shitty person. Yeah okay.,0,-7
gameofthrones,"This is the theory that makes the most sense to me. Especially given that Serio said ""Boy? Girl? You are a sword. That is all.""

Also, when Sansa sentenced Littlefinger to death, she then swung the ""sword"" (Arya) to kill him, in proper Stark fashion.",0,61
gameofthrones,Or maybe the moment Bran wargs made the Night King want to get to him and kill him quickly. Just a hunch though.,0,2
politics,"Already underway, unfortunately. Appears Trump is going to start a war in Venezuela. Time to act is now, if it’s not already too late.

https://twitter.com/breakingnlive/status/1123347696885039105?s=21",0,5
worldnews,Well with Russian troops in the ground specifically to prevent US or NATO intervention I don't think anyone will be willing to risk war with Russia to save this country,0,1
relationship_advice,"For your sake, I would write a letter. Communication can be hard, and you can even do it on a computer so you can edit and revise easier. This way, you can take your time and be thoughtful. Say all the things you want to say, this will be a lot better for your mental health in the long run. It won't be able to eat at you that you never got to say the things you wanted. It's natural to hit ruts in relationships and plateau as people, the important thing is that if you were to work this out and get back together, it should be with the understanding that you should be pushing eachother to be better people and find new hobbies. Life is all about growth, and it seems like you're taking advantage of that now. I'd write the letter, give it to her, and give her time to digest it.",0,1
worldnews,I was thinking Mike Tyson.,0,1
worldnews,"&gt; Why is it so OK for countries with brown people to have their leaders replaced at a whim?

Generally, it's determined by the amount of weaponry and size of the economy. It turns out that if you give *anyone* more guns and money than their neighbors, they'll wind up swinging their weight around. 

A quick look at the demography of Venezuela also shows there are about 300,000 indigenous people left there, so what we're looking at here is people of Northern European descent getting into a squabble with people of Iberian European descent- one set of colonizers having it out with another set.",0,1
freefolk,Hard to say. I do know that a celebration considering what they all just went through seems pretty legit. Plus even Sansa has to admit that their food supplies should be quite sufficient at this point.,0,25
gameofthrones,Luke Skywalker can hang too.,0,1
relationship_advice,"Firstly, thank you for your genuine concern and support. There are a few people I can turn to, but they are also friend with my (now) ex. Much of this is less than ideal. I'm a social worker so I'm used to listening about the issues, not talking about them. So, that's something I need to work on. 

I do feel fucking horrific. I was driving home from work yesterday and caught myself seriously considering driving off of a bridge. Scared me. So, this is my first step to addressing some of this, small as it may be. 

I actually don't have a therapist. I used to be on anti-anxiety meds and antidepressants. They made me feel numb and suicidal, so I tried dealing with things in my own way. Doesn't look like that's gonna cut it anymore. 

As far as the relationship goes. I laid it all out this morning. Told her I loved her, that I was willing to work through any issues. This was violently rejected. Started talking about all my flaws, and shoved my mistake in my face.

There is a song by The Story So Far that speaks to me, with a quote of ""Don't paint me black when I used to be golden."" I realize I have made mistakes, I let some things get the best of me. But I wasn't born this way. Things happened and I'm trying my best. If that's not good enough for her, it hurts, but then again, life hurts.",0,1
worldnews,Weapons of mass destruction you say?,0,16
worldnews,"&gt; nd now, with this breakthrough, you can buy unpasteurised milk anywhere in the world.

Its still pasteurisation.",0,1
worldnews,I am a government shill and I completely agree with u/a_pound_of_weed 😀,0,2
gameofthrones,TV failed me .. laptop was awful... Put it on my phone with maximum brightness... Worked fine. Smallest screen ever but could see everything,0,1
nba,He wants to play and compete but he would not have that chance on a title contender.,0,1
gameofthrones,Dang you are so right! I totally forgot that line from the last episode! He really wasn’t doing a gd thing was he?! Haha,0,1
gameofthrones,"I've noticed that people who are capable of constructing well thought out arguments tend to be on one side, and the people who are capable of ""yeah well I liked it tho"" tend to be on another side.  

It doesn't help that there's a lot of gray area, either. Very few people actually liked everything or hated everything.",0,3
worldnews,"&gt;I know it wasn’t your purpose but I’m incredibly bothered at the audacity 

It is precisely my purpose.",0,67
freefolk,"&gt; Tycho actually insults her to her face at the beginning of the scene by saying “I almost considered your father a very effective and efficient man, but you appear to be redefining those terms entirely”.

I guess I'm missing something, but that doesn't sound like an insult at all.",0,3
relationship_advice,"You deserve better, so much better.  While it is hard to change your life in this major way, you will be happier.  Time to make yourself #1.  I'm currently in that stage myself.",0,1
gameofthrones,"[NO SPOILERS] means any comments with spoilers need to use spoiler tags to cover the information. Show tags are black. Book tags are red. Game tags are orange. For more info please check the [spoiler guide](/r/gameofthrones/w/spoiler_guide).

*I am a bot, and this action was performed automatically. Please [contact the moderators of this subreddit](/message/compose/?to=/r/gameofthrones) if you have any questions or concerns.*",0,1
nba,"Yeah.  Now if he consistently shoots it close to 40% for like a season and continues to shoot it well these playoffs, then maybe you think about taking it away, but still... he shoots like 70% at the rim.  He'd have to really turn into Steph Curry for you to prefer him driving to shooting 3s.",0,13
politics,"If only the constitution addressed voting...

https://en.m.wikipedia.org/wiki/Voting_rights_in_the_United_States#Milestones_of_national_franchise_changes",0,2
worldnews,"A lot of it is. Especially anything pertaining to the collusion investigation And it's evidence.

But a great deal of it is unredacted. Including 10 counts of obstruction and a ton of other crimes found.",0,1
worldnews,dailywire is russian propaganda? now that's hilarious,0,1
nba,"""Because the refs will call them for a foul if they try""",0,1
politics,28 indictments. How the fuck doesn’t he know that?,0,7
nba,Lol he's fucking flopping,0,1
freefolk,it was easily identified,0,1
freefolk,I honestly have no faith in the show-runners handling of Jon moving forward...so nothing would surprise me,0,7
relationship_advice,Go for the job. If you both love each other dearly this will only make it stronger. The last thing that you both want to do is give up these jobs and resent one another. Talking to each other about these and putting everything out there will maybe make it a bit easier for you both.,0,2
relationship_advice,"Dude....dude...

Either shes gonna fall for this girl or you're gonna be banging two chicks at once on the regular. Just go for it and hope for the best. Seriously. 

Oh, and fuck you, ya lucky prick lol.",0,0
relationship_advice,Well glad your girlfriend at the very least appears to be neutral,0,-3
politics,You mean like a “lie”?,0,2
nba,"1. Gianis is unstoppable when he drives

2. Harden hasn't shot that many free throws in a month",0,-23
nba,No you wouldn’t bitch,0,1
